<?xml version="1.0" encoding="UTF-8" standalone="yes"?>

<candies  xmlns:xsi="http://www.w3.org/2001/XMLSchema-instance"
          xsi:noNamespaceSchemaLocation="Candies.xsd">
    <candy id="1">
        <title>Lindor</title>
        <energy>630</energy>
        <candyType>
            <type>CHOCOLATE</type>
            <filling>true</filling>
        </candyType>
        <ingredients>
            <ingredient unit="mg">
                <quantity>15</quantity>
                <name>cacao</name>
            </ingredient>
            <ingredient unit="mg">
                <quantity>20</quantity>
                <name>sugar</name>
            </ingredient>
        </ingredients>
        <value unit="mg">
            <fat>53</fat>
            <protein>4.3</protein>
            <carbohydrates>33</carbohydrates>
        </value>
        <producer country="CHE">
            <enterprise>Lindt</enterprise>
        </producer>
    </candy>

    <candy id="2">
        <title>Konafetto</title>
        <energy>540</energy>
        <candyType>
            <type>CARAMEL</type>
            <filling>false</filling>
        </candyType>
        <ingredients>
            <ingredient unit="g">
                <quantity>10</quantity>
                <name>sugar</name>
            </ingredient>
            <ingredient unit="g">
                <quantity>15</quantity>
                <name>cacao</name>
            </ingredient>
        </ingredients>
        <value unit="kg">
            <fat>4.3</fat>
            <protein>33</protein>
            <carbohydrates>53</carbohydrates>
        </value>
        <producer country="UKR">
            <enterprise>Roshan</enterprise>
        </producer>
    </candy>
</candies>